{
  "schema_version": 1,
  "target_date": "2026-08-12",
  "generated_at": "2026-08-11T04:28:39.764502+00:00",
  "strategy_version": "v1",
  "config_sha256": "5c7f803bf4da07155165b3b1f9075e577746280aa886f2b3d1348643c0b38d82",
  "summary": {
    "discovered": 96,
    "research_complete": 0,
    "research_incomplete": 95,
    "data_unavailable": 1,
    "screened": 1,
    "eligible": 0,
    "rejected": 0
  },
  "candidates": [
    {
      "ticker": "1360",
      "company_name": "日経平均ベア2倍上場投信",
      "market": "東証ETF",
      "discovery_reasons": [
        {
          "discovery_type": "VOLUME_RANKING",
          "source_id": "YAHOO_JP_VOLUME_RANKING",
          "source_url": "https://finance.yahoo.co.jp/quote/1360.T",
          "rank": 4,
          "display_value": "119,614,900",
          "title": "volume: 119,614,900; close: 66; updated: 2026/08/10 18:40"
        }
      ],
      "pipeline_status": "DISCOVERED",
      "reason_codes": [
        "CANDIDATE_RESEARCH_UNAVAILABLE",
        "RESEARCH_NOT_STARTED"
      ],
      "missing_requirements": [
        "candidate_research"
      ],
      "completed_checks": [
        "discovery"
      ],
      "failed_checks": [],
      "source_attempt_ids": [
        "att_yahoo_volume_ranking_20260812_001",
        "att_yahoo_gain_ranking_20260812_001"
      ],
      "source_refs": []
    },
    {
      "ticker": "1579",
      "company_name": "日経平均ブル2倍上場投信",
      "market": "東証ETF",
      "discovery_reasons": [
        {
          "discovery_type": "VOLUME_RANKING",
          "source_id": "YAHOO_JP_VOLUME_RANKING",
          "source_url": "https://finance.yahoo.co.jp/quote/1579.T",
          "rank": 45,
          "display_value": "11,826,530",
          "title": "volume: 11,826,530; close: 771.2; updated: 2026/08/10 18:40"
        }
      ],
      "pipeline_status": "DISCOVERED",
      "reason_codes": [
        "CANDIDATE_RESEARCH_UNAVAILABLE",
        "RESEARCH_NOT_STARTED"
      ],
      "missing_requirements": [
        "candidate_research"
      ],
      "completed_checks": [
        "discovery"
      ],
      "failed_checks": [],
      "source_attempt_ids": [
        "att_yahoo_volume_ranking_20260812_001",
        "att_yahoo_gain_ranking_20260812_001"
      ],
      "source_refs": []
    },
    {
      "ticker": "2146",
      "company_name": "ＵＴグループ(株)",
      "market": "東証PRM",
      "discovery_reasons": [
        {
          "discovery_type": "VOLUME_RANKING",
          "source_id": "YAHOO_JP_VOLUME_RANKING",
          "source_url": "https://finance.yahoo.co.jp/quote/2146.T",
          "rank": 13,
          "display_value": "31,256,100",
          "title": "volume: 31,256,100; close: 221; updated: 2026/08/10 18:40"
        },
        {
          "discovery_type": "PRICE_GAIN_RANKING",
          "source_id": "YAHOO_JP_GAIN_RANKING",
          "source_url": "https://finance.yahoo.co.jp/quote/2146.T",
          "rank": 6,
          "display_value": "+20.77",
          "title": "gain_rate: +20.77; close: 221; updated: 2026/08/10 18:40"
        }
      ],
      "pipeline_status": "DISCOVERED",
      "reason_codes": [
        "CANDIDATE_RESEARCH_UNAVAILABLE",
        "RESEARCH_NOT_STARTED"
      ],
      "missing_requirements": [
        "candidate_research"
      ],
      "completed_checks": [
        "discovery"
      ],
      "failed_checks": [],
      "source_attempt_ids": [
        "att_yahoo_volume_ranking_20260812_001",
        "att_yahoo_gain_ranking_20260812_001"
      ],
      "source_refs": []
    },
    {
      "ticker": "2181",
      "company_name": "パーソルホールディングス(株)",
      "market": "東証PRM",
      "discovery_reasons": [
        {
          "discovery_type": "VOLUME_RANKING",
          "source_id": "YAHOO_JP_VOLUME_RANKING",
          "source_url": "https://finance.yahoo.co.jp/quote/2181.T",
          "rank": 21,
          "display_value": "23,547,500",
          "title": "volume: 23,547,500; close: 282.2; updated: 2026/08/10 18:40"
        }
      ],
      "pipeline_status": "DISCOVERED",
      "reason_codes": [
        "CANDIDATE_RESEARCH_UNAVAILABLE",
        "RESEARCH_NOT_STARTED"
      ],
      "missing_requirements": [
        "candidate_research"
      ],
      "completed_checks": [
        "discovery"
      ],
      "failed_checks": [],
      "source_attempt_ids": [
        "att_yahoo_volume_ranking_20260812_001",
        "att_yahoo_gain_ranking_20260812_001"
      ],
      "source_refs": []
    },
    {
      "ticker": "2477",
      "company_name": "手間いらず(株)",
      "market": "東証STD",
      "discovery_reasons": [
        {
          "discovery_type": "PRICE_GAIN_RANKING",
          "source_id": "YAHOO_JP_GAIN_RANKING",
          "source_url": "https://finance.yahoo.co.jp/quote/2477.T",
          "rank": 33,
          "display_value": "+13.49",
          "title": "gain_rate: +13.49; close: 2,717; updated: 2026/08/10 18:40"
        }
      ],
      "pipeline_status": "DISCOVERED",
      "reason_codes": [
        "CANDIDATE_RESEARCH_UNAVAILABLE",
        "RESEARCH_NOT_STARTED"
      ],
      "missing_requirements": [
        "candidate_research"
      ],
      "completed_checks": [
        "discovery"
      ],
      "failed_checks": [],
      "source_attempt_ids": [
        "att_yahoo_volume_ranking_20260812_001",
        "att_yahoo_gain_ranking_20260812_001"
      ],
      "source_refs": []
    },
    {
      "ticker": "285A",
      "company_name": "キオクシアホールディングス(株)",
      "market": "東証PRM",
      "discovery_reasons": [
        {
          "discovery_type": "VOLUME_RANKING",
          "source_id": "YAHOO_JP_VOLUME_RANKING",
          "source_url": "https://finance.yahoo.co.jp/quote/285A.T",
          "rank": 12,
          "display_value": "32,549,100",
          "title": "volume: 32,549,100; close: 48,010; updated: 2026/08/10 18:40"
        }
      ],
      "pipeline_status": "DISCOVERED",
      "reason_codes": [
        "CANDIDATE_RESEARCH_UNAVAILABLE",
        "RESEARCH_NOT_STARTED"
      ],
      "missing_requirements": [
        "candidate_research"
      ],
      "completed_checks": [
        "discovery"
      ],
      "failed_checks": [],
      "source_attempt_ids": [
        "att_yahoo_volume_ranking_20260812_001",
        "att_yahoo_gain_ranking_20260812_001"
      ],
      "source_refs": []
    },
    {
      "ticker": "3034",
      "company_name": "クオールホールディングス(株)",
      "market": "東証PRM",
      "discovery_reasons": [
        {
          "discovery_type": "PRICE_GAIN_RANKING",
          "source_id": "YAHOO_JP_GAIN_RANKING",
          "source_url": "https://finance.yahoo.co.jp/quote/3034.T",
          "rank": 27,
          "display_value": "+15.52",
          "title": "gain_rate: +15.52; close: 2,419; updated: 2026/08/10 18:40"
        }
      ],
      "pipeline_status": "DISCOVERED",
      "reason_codes": [
        "CANDIDATE_RESEARCH_UNAVAILABLE",
        "RESEARCH_NOT_STARTED"
      ],
      "missing_requirements": [
        "candidate_research"
      ],
      "completed_checks": [
        "discovery"
      ],
      "failed_checks": [],
      "source_attempt_ids": [
        "att_yahoo_volume_ranking_20260812_001",
        "att_yahoo_gain_ranking_20260812_001"
      ],
      "source_refs": []
    },
    {
      "ticker": "3103",
      "company_name": "ユニチカ(株)",
      "market": "東証STD",
      "discovery_reasons": [
        {
          "discovery_type": "VOLUME_RANKING",
          "source_id": "YAHOO_JP_VOLUME_RANKING",
          "source_url": "https://finance.yahoo.co.jp/quote/3103.T",
          "rank": 29,
          "display_value": "17,591,800",
          "title": "volume: 17,591,800; close: 1,189; updated: 2026/08/10 18:40"
        },
        {
          "discovery_type": "PRICE_GAIN_RANKING",
          "source_id": "YAHOO_JP_GAIN_RANKING",
          "source_url": "https://finance.yahoo.co.jp/quote/3103.T",
          "rank": 20,
          "display_value": "+16.34",
          "title": "gain_rate: +16.34; close: 1,189; updated: 2026/08/10 18:40"
        }
      ],
      "pipeline_status": "DISCOVERED",
      "reason_codes": [
        "CANDIDATE_RESEARCH_UNAVAILABLE",
        "RESEARCH_NOT_STARTED"
      ],
      "missing_requirements": [
        "candidate_research"
      ],
      "completed_checks": [
        "discovery"
      ],
      "failed_checks": [],
      "source_attempt_ids": [
        "att_yahoo_volume_ranking_20260812_001",
        "att_yahoo_gain_ranking_20260812_001"
      ],
      "source_refs": []
    },
    {
      "ticker": "3131",
      "company_name": "シンデン・ハイテックス(株)",
      "market": "東証STD",
      "discovery_reasons": [
        {
          "discovery_type": "PRICE_GAIN_RANKING",
          "source_id": "YAHOO_JP_GAIN_RANKING",
          "source_url": "https://finance.yahoo.co.jp/quote/3131.T",
          "rank": 26,
          "display_value": "+15.82",
          "title": "gain_rate: +15.82; close: 5,160; updated: 2026/08/10 18:40"
        }
      ],
      "pipeline_status": "DISCOVERED",
      "reason_codes": [
        "CANDIDATE_RESEARCH_UNAVAILABLE",
        "RESEARCH_NOT_STARTED"
      ],
      "missing_requirements": [
        "candidate_research"
      ],
      "completed_checks": [
        "discovery"
      ],
      "failed_checks": [],
      "source_attempt_ids": [
        "att_yahoo_volume_ranking_20260812_001",
        "att_yahoo_gain_ranking_20260812_001"
      ],
      "source_refs": []
    },
    {
      "ticker": "3156",
      "company_name": "(株)レスター",
      "market": "東証PRM",
      "discovery_reasons": [
        {
          "discovery_type": "PRICE_GAIN_RANKING",
          "source_id": "YAHOO_JP_GAIN_RANKING",
          "source_url": "https://finance.yahoo.co.jp/quote/3156.T",
          "rank": 24,
          "display_value": "+15.97",
          "title": "gain_rate: +15.97; close: 5,120; updated: 2026/08/10 18:40"
        }
      ],
      "pipeline_status": "DISCOVERED",
      "reason_codes": [
        "CANDIDATE_RESEARCH_UNAVAILABLE",
        "RESEARCH_NOT_STARTED"
      ],
      "missing_requirements": [